{
  "prediction_manifest_id": "pred_manifest_fraud_001",
  "dataset_id": "dataset_fraud_demo",
  "version_id": "dataset_version_v1",
  "model_id": "fraud_baseline",
  "model_version": "2026-05-20",
  "task_type": "classification",
  "schema_version": "local-fallback-v0.1.0-demo",
  "artifact": {
    "uri": "s3://dataforge/org_1/project_1/dataset_fraud_demo/v1/predictions.jsonl",
    "hash": "sha256:cccccccccccccccccccccccccccccccccccccccccccccccccccccccccccccccc"
  },
  "rows": [
    {
      "object_id": "txn_00123",
      "true_label": "fraud",
      "predicted_label": "not_fraud",
      "predicted_proba": {
        "fraud": 0.41,
        "not_fraud": 0.59
      },
      "confidence": 0.59,
      "split": "validation",
      "model_id": "fraud_baseline",
      "model_version": "2026-05-20",
      "inference_timestamp": "2026-05-20T07:15:00Z"
    },
    {
      "object_id": "txn_00456",
      "true_label": "not_fraud",
      "predicted_label": "fraud",
      "predicted_proba": {
        "fraud": 0.97,
        "not_fraud": 0.03
      },
      "confidence": 0.97,
      "split": "validation",
      "model_id": "fraud_baseline",
      "model_version": "2026-05-20",
      "inference_timestamp": "2026-05-20T07:15:00Z"
    }
  ]
}
